{
  "id": "plane-5f0e9c1d-updated-1760616000",
  "schema": 1,
  "provider": "plane",
  "account": { "provider": "plane", "id": "ocral" },
  "kind": "item",
  "action": "updated",
  "subject": {
    "kind": "item",
    "ref": {
      "project": { "account": { "provider": "plane", "id": "ocral" }, "id": "8c2f6b0e-4d1a-4b8e-9f3a-2e7d5c1b0a99", "key": "OVERSIRE" },
      "id": "5f0e9c1d-7a2b-4c3d-8e9f-0a1b2c3d4e5f",
      "key": "OVERSIRE-27",
      "url": "https://app.plane.so/ocral/browse/OVERSIRE-27/"
    }
  },
  "at": "2026-10-16T12:02:00Z",
  "summary": { "title": "Event contract and event sources", "status": "In Progress", "actor": "flarco" }
}
